{
  "id": "nasa_apod",
  "asset_type": {
    "type": "table",
    "dataset": true,
    "dataset_container": false
  },
  "name": "nasa_apod",
  "description": null,
  "tags": null,
  "path": "/nasa_apod",
  "has_children": null,
  "details": {
    "primaryKeys": null,
    "namespace": null,
    "configuredCatalog": "{\"streams\":[{\"stream\":{\"json_schema\":{\"$schema\":\"http://json-schema.org/draft-07/schema#\",\"type\":\"object\",\"properties\":{\"resource\":{\"type\":[\"null\",\"object\"]},\"concept_tags\":{\"type\":[\"null\",\"boolean\"]},\"title\":{\"type\":[\"null\",\"string\"]},\"date\":{\"type\":[\"null\",\"string\"],\"format\":\"%Y-%m-%d\"},\"url\":{\"type\":[\"null\",\"string\"],\"format\":\"uri\"},\"hdurl\":{\"type\":[\"null\",\"string\"],\"format\":\"uri\"},\"media_type\":{\"type\":[\"null\",\"string\"]},\"explanation\":{\"type\":[\"null\",\"string\"]},\"concepts\":{\"type\":[\"null\",\"object\",\"string\"]},\"thumbnail_url\":{\"type\":[\"null\",\"string\"],\"format\":\"uri\"},\"copyright\":{\"type\":[\"null\",\"string\"]},\"service_version\":{\"type\":[\"null\",\"string\"]}}},\"name\":\"nasa_apod\",\"supported_sync_modes\":[\"full_refresh\",\"incremental\"],\"source_defined_cursor\":true,\"default_cursor_field\":[\"date\"]},\"sync_mode\":\"full_refresh\",\"destination_sync_mode\":\"overwrite\"}]}"
  },
  "interaction_properties": {
    "stream_name": "nasa_apod"
  },
  "extended_metadata": null,
  "datasource_type_name": null,
  "connection_properties": null,
  "batch_size": null,
  "partition_count": null,
  "partition_index": null,
  "fields": [
    {
      "name": "resource",
      "type": "NULL",
      "length": null,
      "scale": null,
      "nullable": null,
      "signed": null,
      "description": null
    },
    {
      "name": "concept_tags",
      "type": "NULL",
      "length": null,
      "scale": null,
      "nullable": null,
      "signed": null,
      "description": null
    },
    {
      "name": "title",
      "type": "NULL",
      "length": null,
      "scale": null,
      "nullable": null,
      "signed": null,
      "description": null
    },
    {
      "name": "date",
      "type": "NULL",
      "length": null,
      "scale": null,
      "nullable": null,
      "signed": null,
      "description": null
    },
    {
      "name": "url",
      "type": "NULL",
      "length": null,
      "scale": null,
      "nullable": null,
      "signed": null,
      "description": null
    },
    {
      "name": "hdurl",
      "type": "NULL",
      "length": null,
      "scale": null,
      "nullable": null,
      "signed": null,
      "description": null
    },
    {
      "name": "media_type",
      "type": "NULL",
      "length": null,
      "scale": null,
      "nullable": null,
      "signed": null,
      "description": null
    },
    {
      "name": "explanation",
      "type": "NULL",
      "length": null,
      "scale": null,
      "nullable": null,
      "signed": null,
      "description": null
    },
    {
      "name": "concepts",
      "type": "NULL",
      "length": null,
      "scale": null,
      "nullable": null,
      "signed": null,
      "description": null
    },
    {
      "name": "thumbnail_url",
      "type": "NULL",
      "length": null,
      "scale": null,
      "nullable": null,
      "signed": null,
      "description": null
    },
    {
      "name": "copyright",
      "type": "NULL",
      "length": null,
      "scale": null,
      "nullable": null,
      "signed": null,
      "description": null
    },
    {
      "name": "service_version",
      "type": "NULL",
      "length": null,
      "scale": null,
      "nullable": null,
      "signed": null,
      "description": null
    }
  ]
}
